postId:ID(Post),title,body,score,views,comments1,How should I store whole bean coffee?,"<p>I just got a pound of microroasted, local coffee and am curious what the optimal way to store it ",49,3016,42,How fine should I grind coffee for drip/pour over coffee,<p>I manually grind coffee beans for drip coffee but I thought that depending on whether the coffee ,7,1163,43,Does the hardness of water matter when making coffee?,<p>I live in a hard water area and when brewing English Tea I can <em>definitely</em> taste and see ,30,1677,14,What's the theory behind using thin spouted kettles when making drip/pour over coffee,<p>I own a drip coffee pot:<img src=https://i.stack.imgur.com/H0sqP.jpg alt=enter image description ,10,335,85,How important is tamping coffee for an espresso machine,<p>I observe that coffee servers (I refuse to use the term barista) will apply pressure to the coffe,21,1319,06,Why is it not recommended to drink coffee immediately after it's roasted?,"<p>The rule of thumb is that you first drink coffee approximately 3 days after it is roasted, but wh",41,43217,27,,<p>Tamping is one of three key controls you have over the espresso brewing process; The others are d,18,,18,,<p>Let's start off with what the function of the tamp is.</p><p><img src=https://i.stack.imgur.com/x,15,,09,What factors affect espresso crema?,"<p>For a given coffee and roasting method, what factors of the espresso making process affect the cr",11,2122,010,Why do barista's keep activating the doser whilst grinding coffee,<p>I notice that some barista's keep whacking the doser on the coffee grinder when they fill the esp,10,421,011,,"<p>Fresh off the roast, coffee has high levels of carbon dioxide and nitrogen (based?) gasses. These",30,,912,How should I store ground coffee?,"<p>I came across <a href=https://coffee.stackexchange.com/q/1/19>this question</a>, which seeks the ",15,1502,313,How long can I store ground coffee in the fridge?,"<p>I ground some coffee beans this morning, but I'm not a major coffee drinker, how fast can I expec",10,298,014,What is the process to reduce bitterness in coffee?,<p>I've heard of adding salt to coffee to reduce its bitterness.I've also heard that using freshly r,28,4023,015,,"<p><strong>Yes.</strong></p><p>That is to say it will definitely affect flavor, but how it affects t",23,,416,How does the temperature of the water affect the taste of the coffee,<p>Many methods of brewing coffee differ in the temperature of the water among other factors. Some p,16,5177,417,,<p>From <a href=http://en.wikipedia.org/wiki/Espresso#crema rel=noreferrer>Wikipedia</a>:</p><blockq,5,,818,,"<p>In general, it's best to <em>not</em> store ground coffee. If quality really matters, then the re",11,,519,,<p><strong>Coffee should never be stored in the fridge!</strong></p><p>In the same way that <a href=,15,,621,,"<p>In general, the coarseness of fine sand. It will be difficult to effectively communicate grind si",4,,022,,<p><strong>In general consistency is more important than a specific setting.</strong></p><p>The key ,7,,023,,<p><strong>Short reason:</strong> Tradition conflicting with modern brewing practices.</p><p><strong,14,,024,,"<p><strong>In a cool, dark, dry, place and whenever possible vacuum sealed.</strong></p><p>The oils ",46,,125,homemade cleaner for basic drip coffee maker,<p>Is it possible to create a cleaning agent to use on a basic drip coffee maker using household ite,6,119,826,Upward size limit for espresso makers,"<p>In my, somewhat limited, experience with espresso machines they generally only produce a few shot",6,129,027,,"<p>The volume of espresso that your machine makes, is limited to the size of it's boiler and it's ab",4,,028,Are high-end cone grinders adjustable?,<p>I switched from a modestly priced blade grinder to a moderately priced cone grinder because the r,6,128,029,What type of roast has the lowest caffeine content?,"<p>I'm aiming to reduce my caffeine intake, but don't want to drop coffee altogether. What roasts / ",16,2554,130,,<p>The key here is <em>extraction</em> from the espresso coffee. Only so much desirable flavor and b,5,,131,,<p><strong>Yes.</strong></p><p>What you describe as a conical grinder is also known as a burr grinde,4,,032,,"<p>Yes, high end grinders are generally adjustable. Some even have macro and micro adjustments. For ",5,,033,,"<p><strong>Temperature affects extraction rate, but also varies between compounds in the coffee bean",13,,034,,"<p>In general, <strong>darker, arabica</strong> roasts have less caffeine. Arabica (as opposed to ro",15,,435,,<p>Bitterness comes from over-extracting coffee. Over-extraction is mainly caused by:</p><p>1) brewi,9,,236,How do I backflush my espresso machine?,<p>I just recently purchased an <a href=http://www.wholelattelove.com/products/ecm-technika-iv-espre,10,388,137,,"<p>By having a thin spout, you can more finely control the flow rate and where the water lands.    W",14,,038,How hot should water be to brew ground coffee directly in a cup?,<p>I don't have a coffee press so I just brew ground coffee as you would tea: in the cup. </p><p>How,10,268,039,What is the hexagon funnel shaped thing that came with my aeropress for?,"<p>When I bought my aeropress, it came with this weird hexagon thingy: <img src=https://i.stack.imgu",35,5247,041,,"<p>It took me an embarrassingly long time to realize the purpose of this hexagon shaped funnel, so I",47,,642,,"<p>I'm no expert, but a frequent enjoyer, and I also use freshly ground coffee in a cup, then pour w",4,,143,How to prevent calcium loss when drinking a lot of coffee?,<p>I'm recently drinking a lot of coffee at work. I'm worried about the health issues - lost of calc,10,288,344,What does the 'strength' mean (in numbers)?,<p>The coffee package I've bought has 'strength rating'. It's 3 out of 5. </p><p>I wonder what that ,11,26777,145,,<p>Your method most closely resembles <a href=http://en.wikipedia.org/wiki/Turkish_coffee>Turkish Co,8,,046,,<p>There are a lot of factors that contribute to the bitterness of coffee. Some of these have to do ,19,,048,Which type of coffee grinder is the quietest?,<p>Perhaps my question should be What is the best type of grinder to use at my desk if I work in a c,13,3484,349,,<p>A manual coffee grinder like the Hario Ceramic Coffee Mill.</p>,5,,150,,<p>I go with around 165 degrees Fahrenheight (73 C).</p>,0,,151,,<p><a href=http://www.wholelattelove.com rel=nofollow>WholeLatteLove.com</a> actually provides decib,6,,052,Roast vs Body vs Acidity,<p>Coffee flavor is often described in terms of:</p><ol><li>Roast darkness (light to dark)</li><li>B,7,3880,153,How V60 and Aeropress affect flavor,<p>I've heard that the V60 is better for light roasts and the Aeropress is better for Medium to Dark,12,2810,154,When to use stirring to increase extraction?,<p>I often find that some methods of brewing for a particular implement differ on whether or not to ,7,480,055,,<p>Backflushing is a fairly straightforward procedure. You only need <strong>two</strong> things:</p,10,,156,How to grow coffee at home?,<p>I am a heavy coffee user and I want to know what's in my coffee and therefore I'd like to grow co,23,976,757,,"<p>First, lets ignore blade grinders entirely.  Any grinder that doesn't have a motor will be relati",15,,258,What's the most effective way of generating crema from an Aeropress?,<p>I know a number of people have become fairly capable at getting a nice amount of crema at the end,35,29280,159,,<p>Coming from Germany myself I have seen this rating only on a single brand of coffee. There is no ,9,,160,What is a shot?,"<p>I have visited Starbucks lots of times for their delicious coffee. As I stand in line, I hear peo",13,12806,061,,<p>They are referring to a &quot;shot&quot; of espresso.  The <a href=https://en.wikipedia.org/wiki/,24,,162,,"<p>A shot in this context usually means one ounce, or so, of espresso. So a cup of coffee with two e",9,,063,"Milk quantity and consistency in cortado, cappuccino and latte",<p>I am often asked whether these three drinks have the same milk quantity and/or consistency and wh,11,105998,064,,<p>It is possible to grow coffee indoors. If allowed to grow as a tree they can reach 8 feet tall bu,16,,266,What coffees are the least acidic?,"<p>I don't like coffees with an acidic/sour taste. However, when buying coffee, the only rating one ",22,18077,067,,<p>Body can sometimes also be described as mouth feel.  How heavy the coffee feels in ones mouth.  R,2,,068,,<p><strong>There's a chart for that!</strong></p><p>Here's a <a href=http://cdn.shopify.com/s/files/,15,,169,,"<p>I'm not really an expert, but in basic terms:</p><p>Roast darkness: </p><ul><li>Roughly how long ",3,,070,How can I minimize the amount of grounds at the bottom of my French press coffee?,"<p>Whenever I brew coffee with a French press, I tend to get a significant amount of grind left near",29,41541,371,,"<p>I find that most of the Brazil dry processed coffee I get is very smooth or low acid.  However, i",8,,172,,<p>The flavor and aroma of the beans continue to develop for the first few days after roasting as th,22,,173,,<p>It sounds like you may be grinding the coffee a little too fine or your press may be bent out of ,5,,075,What is/are the ideal brewing temperature(s) when preparing coffee?,<p>I know that coffee in a coffee machine is usually prepared using a temperature between 91–94 °C. ,2,86,176,,<p>Are you using a burr grinder or a blade grinder? Blade grinders physically cannot give a consiste,13,,177,,<p>Stirring should be used if the grounds were not evenly dispersed in the beginning of the process ,4,,078,Most moka pots don't work on my induction stove. How can I still use them?,<p>Most moka pots don't work on my induction stove. How can I still use them? I use a camping stove ,14,65854,079,How can I figure out how much caffeine is in my cup?,<p>I haven't been able to find a good way to approximate the amount of caffeine in the coffee I make,68,205712,480,,<p>That sounds like the generalization that drip or pour over brewing is better for light roasts and,8,,481,"Why isn't coffee commonly sold in sachets, like tea bags?",<p>I was wondering why single serving coffee <a href=http://en.wiktionary.org/wiki/sachet>sachets</a,39,85766,682,,"<p>Sumatran coffees (and others from the Asia/Pacific region, like Java and Arabia) are uniformly lo",13,,284,How does coffee grind size affect coffee taste,<p>I have a grinding machine with a lot of different settings. Even between the categories of Fine a,15,9649,285,,"<p>I have the same problem, and these things definitely reduce it:</p><ol><li>Grind more coarsely. B",27,,186,,"<p>Because coffee is an agricultural/baked item and like bread, goes stale.  Between roasting, grind",16,,487,,<p>The main reason for different grinds is the different brewing processes. If the water is exposed ,14,,288,,<p>Well I am not sure how thay did it but here is the website about the amount of caffeine there is ,14,,689,How does the altitude at which beans are grown affect the final roast?,<p>In what way does the altitude at which coffee beans are grown affect the flavor of the final roas,6,252,490,,"<p>As a matter of fact, coffee is commonly sold in some kind of sachets.</p><p>In Japan, there is wh",28,,1391,,"<p>Most high-end automatic grinders allow you to adjust for coarseness, not speed, as they're driven",4,,092,,"<p>The Starbucks-owned brand Seattle's Best Coffee uses numbers on its bagged supermarket coffees, t",2,,093,How does pressure affect the flavor of espresso?,<p>I've noticed the water pressure from espresso machines varies from about 12 psi to 22 psi. What e,14,3626,094,How much caffeine is in an espresso shot?,<p>Many people seem to think that a 0.85oz shot of espresso has the same amount of caffeine as a cup,16,67872,095,Amount of milk in a macchiato beverage,<p>What is the correct amount of milk to put into a macchiato? Does it depend on the amount of espre,6,4306,096,How will cold brewed coffee differ from traditional hot-water extraction methods?,"<p>Generally speaking, what do <a href=http://en.m.wikipedia.org/wiki/Cold_brew>cold brewed</a> meth",42,2331,597,Generating crema with a moka pot?,<p>I have a stove top percolator for making espresso.  It does not generate any crema.  it possible ,15,19713,298,Why do we need to fold the border of filters?,<p>Standard and V60 paper filters require we fold the border before spreading them for dripping.</p>,16,9780,799,Does storing coffee in a freezer preserve freshness?,"<p>Does storing ground coffee in a freezer make it stay fresh longer? If so, how long will it remain",21,1575,1100,How do I judge the quality of 'green' beans?,"<p>I'll have a chance to visit some coffee farms in the coming months, at which time I'll be able to",8,649,0101,,<p>This question will largely be based off of the individual tastes of the person consuming the drin,1,,1102,,"<p>No. In fact it's likely to make your coffee taste bad, and gum up your grinder. You should store ",22,,4103,,"<p>According to caffeineinformer, there is <a href=http://www.caffeineinformer.com/caffeine-content/",10,,0104,Are reused glass jars ever fit for storing ground coffee?,<p>I'm looking for some small container to store small amounts of ground coffee. </p><p>I have a lot,9,1901,1105,,<p>I have been purchasing everything from cheap beans to rather pricey beans and what i discovered w,8,,1106,,"<p>The method of brewing you describe is commonly known in Poland, Belarus, etc, as 'Turkish coffee'",8,,0107,Does Nespresso contain sugar?,"<p>I've been told that Nespresso capsules contains sugar, but the site <a href=http://www.caffeinein",9,13779,1108,,<p>My experience is that even if you grind precisely as you should there will always be coffee resid,4,,0109,,"<p>My experience is that some jar lids are almost impossible to make completely odorless, while the ",6,,4110,,"<blockquote>  <p>Coffee is a pure and natural product, consisting only of water and  roasted coffee ",12,,0111,Should I thoroughly clean the portafilter basket between shots?,<p>When I'm making lots of individual drinks I tend to clean the portafilter basket thoroughly and t,18,4491,0112,,"<p>Based on the study entitled <strong>Effects of Altitude, Shade, Yield and Fertilization on Coffee",4,,0113,Why do coffee packs have an aroma hole if it is recommended to store coffee in an air tight container,<p>If it's recommended that coffee should be stored in an <a href=https://coffee.stackexchange.com/q,11,5525,0115,How do I know how hard to tamp my coffee?,"<p>For someone without an expensive machine that can regulate the pressure when tamping, how can I k",8,2648,2116,What is the difference between Robusta and Arabica?,<p>Different coffee packets advertise different amounts of 'Robusta' and 'Arabica'? What do these te,18,2116,0117,,"<p>Its nothing but a marketing gimmick, enabling the user to use the degassing ventilation hole as <",5,,0118,,<p>Robusta and Arabica refer to different beans that are used for the coffee.</p><p>In general it ca,5,,1119,,<p>When i started brewing espresso some years ago i started out with placing a robust scale on the c,6,,2120,How is decaffeinated coffee made?,<p><img src=https://i.stack.imgur.com/tNs6ym.jpg alt=what&#39;s the difference between regular and d,17,4220,0121,,"<p>Yes, you just need to get a pot that's made of the right stuff. Induction hobs only work with mag",11,,1122,When and how should I clean my moka pot?,"<p>I regularly use a moka pot for making coffee, and I've heard different people tell me about clean",15,19330,0123,When does coffee go off?,"<p>If I've ground a batch of coffee, I know I should use it as soon as possible, but if I store it (",32,3438,0124,Why do some people sneer at Starbucks coffee?,"<p>Business practices aside, Starbucks coffee seems to get a lot of derision from people who conside",16,684,5125,What differentiates a $100 coffee machine from a $1000 coffee machine?,<p>There is a huge amount of price variance for coffee machines. Just a quick look in any shop will ,16,1703,5126,How can I use any pod in a Keurig 2.0?,"<p>I have a Keurig 2.0 machine, that won't accept anything but authorised coffee pods. I've read tha",6,132,0127,Do I need to boil the water before using my moka?,<p>I was recently told that I could improve the flavour of my moka pot coffee by boiling the water s,7,546,0128,What preparation method yields the most caffeine?,<p>I want to make the most caffeinated coffee possible. What method should I use to yield the most c,12,5246,0129,,<p>The first thing you want to do is choose the right bean and the right roast.</p><p>Longer roastin,11,,3130,,<p>It is true. </p><p>Preboiling the water will make the coffee tastes a lot better. It will reduce ,7,,0131,What are the differences between Jacobs Krönung and Jacobs Cronat Gold?,<p>Jacobs got two major brands:</p><p><img src=https://i.stack.imgur.com/Zd1FRm.jpg alt= />         ,8,36612,1133,,<p><strong>Check for coffee related features</strong>. </p><p>These are things which make your coffe,5,,0134,,"<p>Starbucks is a coffee-chain, but <a href=http://www.howardbehar.com/book.shtml>It's not about the",13,,2135,,"<p>In order to maintain consistency, Starbucks roasts their coffee a <em>tad</em> bit longer than ma",34,,4136,,<p>Jacobs Cronat Gold is smoother and more mild than Jacobs Krönung Instant coffee.Krönung is blende,2,,1137,Does pre-heating a puck on the group head produce more crema?,"<p>In my never-ending quest to get just a <em>little</em> more crema out of every shot, I've been ex",8,713,2138,,<h2>Basics</h2><p><strong>Decaffeination</strong> (<em>decaf</em>) is the removal of <strong>caffein,18,,0139,Is Kopi Luwak safe to drink?,"<p>Kopi luwak, i.e. Vietnamese weasel coffee, is made from beans that have been consumed and excrete",27,9757,1140,,<p><img src=https://i.stack.imgur.com/MzlPd.png alt=THIS SHOULD HELP :) /></p><ul><li>One reason tha,23,,0141,,"<p>Yes, it's perfectly safe to drink and <em>extremely delicious</em>. In The Philippines, we often ",38,,5142,,<p>Each new bean becomes a bit of an experiment with each new machine you use.</p><p>A rule of thumb,9,,0143,,"<ol><li><p>Coffee enthusiasts &amp; aficionados identify acidity as the dry, bright &amp; sparkling ",8,,0144,,<p>The Keurig 2.0 machine is looking for an element (perhaps magnetic?) that is embedded in the auth,7,,0145,,"<p>There's a trade-off here. If you're working in a fast-paced coffee shop, you're likely to favour ",14,,0146,,<p>The flavor constituents of roasted coffee are the result of high roasting temperatures. After roa,22,,1147,What constituant in coffee has a laxative effect?,<p>My question is as simple as it sounds. I want to know <strong>which constituent in coffee makes m,15,903,7148,,"<p>The Civet cat is out of the Java bag, and people around the world are bidding up the cost for thi",17,,0149,Does coffee cause dehydration?,<p>Actual scientific information on the effects of food and drink is notoriously hard to sift from a,18,937,2150,Is it easier to froth full-fat milk?,"<p>Is it better to use whole (full-fat) or semi/skimmed milk for a cappuccino, or does it make no di",8,5441,0151,,<p>From experience it seems slightly easier and is less runny. The difference for me is pretty negli,4,,0152,,"<p>More expensive coffee machines typically have better plumbing, including some and even all of the",17,,0153,Generating Crema with a manual machine,"<p>I have a La Pavoni Pro, and noticed that I am a bit inconsistent with the crema. I have read <a h",10,724,4154,,<p>As I understand it caffeine itself is a mild diuretic. Some say this effect quickly goes away (wi,4,,1155,,<p>The short answer is yes. The absence of the milk fats means that the foam will not &quot;coagulat,6,,2156,,"<p>Disclaimer: I am not a doctor, nor do I play one on TV...</p><p>I would guess that it is a combin",8,,4157,"Why are lattes often served in big, wide cups?",<p>Lattes are often served in a cup that looks like this:</p><p><a href=http://silvestregustolatino.,16,4035,0158,,"<p>If you stop washing your mocha pot completely, you'll see a bit of a residue buildup  on the insi",12,,1159,Is it safe to brew old coffee?,<p>I found a 10 year old package of coffee. Is it safe to brew it? Or should I get a new one?</p>,9,23383,5160,What actually happens with the ground coffee that lost its flavour?,<p>Ground coffee looses quickly its flavour. It's especially painful for singles living in rented ap,12,172,0161,,<p>I prefer lattes in big wide cups as it allows me to enjoy it with a multitude of senses.</p><p>Th,8,,3162,,"<blockquote>  <p>If it's refrigerated, it'll last for at least a week, as long as you didn't pre-dai",3,,0163,Is it necessary to allow a shot of espresso to rest before adding it to a drink?,"<p>After making a shot (or multiple shots) of espresso, there appears to be a lot of activity going ",10,205,0164,"When making a long black, how long should hot water cool before adding espresso before combining?",<p>A long black is made by pouring espresso into hot water-- effectively the reverse of an americano,6,2286,3165,,<p>Here's a quick rundown of the Aeropress method I use every morning. I end up with a relatively cr,20,,14166,,<h1>Whole Bean Coffee Degradation Over Time</h1><p>Whole bean coffee will go stale within 14 days - ,34,,26167,How can I identify which Keurig machines have Keurig 2.0 DRM?,"<p>To be more specific, is there a particular label or marking on the package that will indicate if ",7,1542,2168,,<p>To Expand on @Tom Medley's Answer; the pivotal questions are:</p><ol><li>How much time is lapsing,11,,0169,,"<p>Though caffeine's action as a diuretic is hotly debated, recently it seems the scientific consens",12,,4170,What happens if you fail to clean a steam wand after frothing milk?,<p>Our lovely <a href=http://www.lamarzocco.com/en/products/linea.html>La Marzocco Linea</a> at Stac,12,1333,0171,Coffee cup patina; is there any logic in not washing the cup,"<p>I first encountered the practice of never washing a coffee cup, when I was sternly warned, and ne",18,13690,0172,,"<p>Not necessary in my opinion.  In fact, i prefer to add it as soon as possible.  The activity you ",6,,0173,,"<p>I cant speak for this particular machine,  but i failed to clean the steam frother on my old mach",3,,0174,,"<p>It may be superstition but many people, myself included, don't wash out their coffee cups. I rins",7,,0175,,<p>The Italian word <em>macchiato</em> literally means marked or stained (related to the word immacu,7,,0177,,"<p>It may be just me, but I think it has to do with aiming for a ratio of foam to liquid in each sip",12,,0178,Reusable Nespresso pixie capsules,<p>Has anyone had experience with reusable Nespresso pixie capsules (similar concept to the Keurig c,7,281,0179,,<p>Word on the street is that:</p><ol><li>The milk residue will get baked on by the heat of the stea,8,,5180,Will using teabags in a Keurig cause problems?,<p>Am I at risk of damaging my Keurig machine if I place an ordinary black tea bag inside instead of,9,6568,1181,,"<p><strong>Lets answer this question with some data!</strong> My company uses machine learning, data",21,,6182,,<p>The Short answer  to this is no. You should not use a glass jar for storing coffee. </p><p><stron,9,,2183,Use for old grounds?,"<p>I'm aware that coffee grounds can be great for composting, but living in a large city makes that ",13,289,0184,How can I go about developing my ability to taste flavors in coffee?,"<p>I've been home-roasting coffee for over a year now, starting with stovetop pan roasting, then mov",19,659,1185,,"<p>They are very good as de-odourizers, we use them in the kitchen and sometimes in a small perforat",14,,5186,Home roasting and ventilation,<p>I have been home roasting with a Gene Cafe since early this last summer.  I chose the Gene Cafe s,12,1596,13187,,<p>Roaches love coffee. For someone living in a city a roach trap seems like a good solution (but I ,5,,0188,,"<p>It will not damage the machine; However, it won't brew properly.  Your tea is supposed to steep i",7,,1189,,<p>There are several approaches that can aid in developing your palate.</p><h2>Cupping</h2><p>The pr,18,,3190,,<p>The answer is <em>dependent on the coffee you're serving</em>. I've worked with several blends fr,3,,0192,How do I get started in roasting my own beans at home?,<p>I'd like to experiment with roasting my own beans at home.</p><p>I'd like to keep the equipment r,18,466,0193,Where to buy small batches of unroasted beans,<p>I want to dabble in home roasting.</p><p>Where can one typically source unroasted beans from? Do ,3,111,1194,,<h1>Cold Brew Coffee - A Brief look at Flavor Profiles</h1><p>My company builds flavor profiling and,37,,4196,,<p>There are several websites that sell unroasted or green beans in a range of quantities and will s,5,,1197,,<p>By far the easiest way to start at home roasting is with a hot air popcorn popper.  You can get a,14,,1198,,<p>I would (with some bias) highly suggest reviewing <em>all</em> of the coffee you drink using Gast,2,,2199,,<p>Amazon sells them for a pretty decent price.  I purchased several pounds.  Also if you have amazo,3,,0200,,<p>I recommend <a href=https://www.sweetmarias.com/store/>Sweet Maria's</a>. You order online and th,5,,1201,,"<p>Even though <em>caffeine</em> may be a mild diuretic, most <em>coffee</em> is over 99% water, con",3,,0202,What is the optimal length of time for pulling a shot of espresso?,"<p>Assuming:</p><ul><li>The beans are ground correctly, and are of good quality</li><li>You have the",5,743,0203,,<p>That will completely depend on the blend of espresso you are using.  Different coffees will have ,6,,0