postId:ID(Post),title,body,score,views,comments4644,,"<p>Degassing - what a lovely topic.</p><p>May i offer an experience is that, regardless of roast:of ",1,,14645,,"<p>Noah, sadly not a direct answer, but may i recommend that you reach out to your favourite supplie",1,,04646,,<p>It's interesting how negative folks can get about freezing coffee.</p><p>There are a few places w,2,,14647,,<p>My goodness - all sorts of new gadgets to get intrigued about - and now - you have a reason to bu,1,,14648,,<p>Hi not likely to be a trait of kirkland beans or of packaging of the beans.Static electricity can,3,,04649,,<p>i'm wondering if this is a wee joke?In any coffee joint in north america it's common to have a na,1,,24650,,"<p>As noted in the replies above, the receive wisdom is pretty much don't stir just - wet - bloom - ",1,,04651,,"<p>As per Kyle above, YEs coffees fresher to roasting are expelling more gas than older ones that ha",3,,04652,Keeping milk frother in shape,<p>We recently got new Milk Frother and I do not intend to it have residue which burns up as describ,1,185,04653,,"<p>For someone who works with high commercial grade espresso machines, I clean my shop's machine onc",-1,,04654,,"<p><strong>Bottom Line</strong>: When someone allows their coffee to bloom, they are pouring just en",2,,34656,"Whenever I froth my milk and pour it into the espresso, it dries and makes water under it. How do I fix that?",<p>So I'm learning how to make coffee and I absolutely love it but the hardest part about it is stea,2,88,34657,How do I vary between how much froth for each coffee drink?,<p>I was always taught that for flat white and lattes they need 1cm of foam and for cappuccinos 2cm ,2,41,04658,"Dual Hopper Grinder, Single Brewer, Mixing Flavors! Please help!","<p>I own a small coffee shop, and the regulars love their flavored coffee.  To help improve the work",1,39,14659,,"<p>I found over the course of a few weeks, I was feeling nauseous in the mornings.  It took me a whi",0,,04661,Will emptying used coffee grounds into the sink drain damage my pipes?,<p>I've been using a French press and emptying the grounds into the sink afterwards The main reason ,4,201,04662,,"<p>You don‘t need the advice of coffee drinkers, you need advice from a plumber (which I am admitted",5,,34663,Best practices for reheating coffee,"<p>By the time I come home from work in the morning, a pot of coffee that was brewed by others in my",2,145,04666,,<p>Cold-brewed coffee heats well. Hot-brewed coffee that is old (whether on the warmer for hours or ,4,,04667,Espresso consistency,<p>Amateur just getting started with a Breville - not happy with the results but I know I have lots ,4,894,14668,,<p>It's not really about consistency but more about getting the right extraction time for the coffee,1,,114672,Ignoring Krups instructions re descaling,"<p>I was given a very special Krups coffee machine that grinds and makes the coffee, for a big birth",1,694,14675,,<p>The quality of your espresso is going to depend on two things: Your grinder and your water. Water,1,,54676,What type of coffee maker creates the most coffee scent?,"<p>I stopped drinking coffee for a while but recently picked it back up, mainly because I enjoy the ",3,1452,14680,,"<p>If you want a lot of scent, you will want to make sure that nothing stops evaporation - so no lid",2,,04681,,<p>I believe coffee lovers consume coffee to be able to drink that smell. I just want to add to Step,1,,04682,What does moka pot cups mean?,"<p>I bought a moka pot days ago and have been using it almost everyday, each time i fill it with gro",1,728,04683,,"<p>In case this question still lingers on yours or other users' mind ... Pressurized PF is not PS, s",0,,04684,,"<p>You are correct, four cups means four servings - but a serving is an espresso cup, not a mug. </p",1,,14685,,"<p>Moka pots, of which the standards are more or less defined by Bialetti, produce enough coffee for",0,,04688,,<p>If you look at the <a href=https://www.nespresso.com/us/en/service-faq rel=nofollow noreferrer>Ne,0,,04689,Tap water or bottled water?,<p>What is generally considered better for the perfect cup of filtered coffee. Tap water or bottled ,4,504,04690,,<p>I didn't know this till I just read it:</p><p><a href=http://time.com/3029191/bottled-water-ingre,0,,04691,,<p>Bottled water is not typically safer than tap water.In fact more than haft of all bottled water c,1,,14693,,"<p>A nespresso contains 100% ground coffee.It is not instant,and it does not contain any kind of add",0,,14694,,<p>Reverse osmosis water is the best for making coffee and drinking. It tastes way better than my ta,0,,14695,,"<blockquote>  <p>Just think that your drink, coffee, is around 97-98% water so you need quality wate",4,,34696,,<p>I’m amused at the variety of solutions to this simple problem. As a retired career specialty coff,0,,04698,,<p>The other option you may consider is cold brew.  I personally favor this as it is less bitter and,0,,04699,How can I make coffee without a machine?,<p>I love coffee. As I am a student and living in a hostel I do not have any machine and I can not a,3,549,04700,,"<p>If you have access to an electric outlet, small coffee machines are cheap. If you have access to ",4,,04701,,<p>A pour over coffee cone and paper filter will make excellent coffee. You'll only need to get good,6,,04702,Why do sugary foods taste so good with black filter coffee (no sugar)?,<p>Just wondered why my black moccomaster filter coffee from bean tastes so good with sugary foods l,1,89,14703,,<p>I would use distilled water.  It gets out more impurities.</p>,0,,14705,,<p>Get a french press.  they are inexpensive and make great coffee.  You just need some boiling wate,3,,04706,,<p>I can neither confirm nor deny that I do the following:</p><ol><li><p>After each brew cycle rinse,0,,04707,,"<p>I recently visited a coffee festival in Amsterdam and there were some discussion on this topic, o",1,,24709,,<p>Honey sounds weird to me - you do want it to run out in 12-25 seconds and you want it to be thick,0,,14710,Leak in base of Moka pot,<p>I have a modern Bialetti stovetop moka pot. It's been used in an induction hob.</p><p>It has deve,1,441,04711,,"<p>We get our tap water from local sources, such as rivers and lakes. This water may contain bacteri",0,,04712,,<p>I had 2 cups of coffee with soy milk the other day. The first cup was delicious. The second cup c,1,,04713,,"<p>Unfortunately I can give you only a half-answer.</p><p>A) No, I can’t explain what caused the hol",2,,04714,,"<p>Cold brew, SUPER simple version. A.K.A. my college days version. </p><p>One tbsp of any coffee pe",7,,24717,How to make lungo with Lavazza AModo mio?,"<p>We bought a new Lavazza A Modo Mio recently, and can’t seem to program it to make a larger cup. I",2,107,04718,Does hydration level change the effect of caffeine?,"<p>Apologies if this question does not belong here, it may be suit for the <a href=https://chemistry",6,91,04719,,<p>Heating it up on the stove top on low temperature. This doesn’t require any special spoons or pot,-1,,14720,Coffee Roasting Yields,<p>I am trying to understand yield control in coffee roasting. In other areas of the food industry I,1,30,04721,Can I just put the coffee on top of the water in a French Press?,<p>Related: <a href=https://coffee.stackexchange.com/questions/1683/does-the-bloom-matter-in-french-,1,189,04722,,<h3>Container brew and discard the sludge</h3><p>As detailed <a href=https://coffee.stackexchange.co,2,,04723,How much volume of the shot should pre-infusion take up?,<p>The espresso machine I use at work has a pre-infusion step. I've been wondering if the volume of ,2,276,14724,,<p>Confession:<br>Many rules about making coffee are writen by perfectionists (or snobs or self-decl,4,,14725,,"<p>I too, seem to be perpetually searching for the perfect coffee. I am not looking for sweetness, b",3,,14726,,"<p>I've had this problem for years, every time I replace the rubber gasket on my 6-cup Bialetti.  Bu",0,,04727,"Will Twist Press really taste like espresso, made by hand?",<p>The <a href=https://www.kickstarter.com/projects/300166132/the-twist-press-coffee-maker-from-bari,1,208,04728,"If I only occasionally brew at home, should I keep instant or grounds (or something else)?",<p>Related: <a href=https://coffee.stackexchange.com/questions/4471/is-it-a-good-idea-to-keep-a-coff,3,100,04729,How to avoid channels when pouring espresso,"<p>I've been having issues with my espresso pouring too fast, and I think I'm getting channels (unev",3,319,24730,,<p>I've been that person - I kept ground coffee forever. The difference in taste between fresh and o,4,,04731,Lavazza Amodo Mio - steams,<p>When I try to make a cup of coffee my Lavazza machine steams and splutters all over the place/thr,2,33,14732,,<p>This won't fix the coffee but it might not taste as bad. Do a normal french press but do a crazy ,0,,04733,Can I store wet coffee beans in the fridge?,<p>My coffee beans accidentally got wet. Can I store them in the refrigerator for 3 to 4 days? Or no,1,381,04734,,"<p>From a food safety perspective, three to four days should be fine. For longer periods, simply fre",2,,04735,How to get an even drip without Mr. Coffee filtration disks,<p>I’ve been trying to figure out why our coffee has been very weak despite double the amount of gro,2,50,04736,"To what temperature do coffee grounds need to be freezed at, after getting wet?",<p>As per this question <a href=https://coffee.stackexchange.com/questions/4733/can-i-store-wet-coff,2,80,04737,,"<p>Let me suggest different approaches that are much tastier, assuming that's your aim.</p><p>You ca",2,,04738,What temperature to dry wet coffee grounds and for how long?,<p>As per <a href=https://coffee.stackexchange.com/questions/4733/can-i-store-wet-coffee-beans-in-fr,1,299,04739,How many times can I reuse coffe-grounds to make myself a coffee until it is tasteless/useless?,<p>How many times can I reuse coffe-grounds to make myself a coffee until it is tasteless/useless or,2,1047,14740,Is it possible to get hot chocolate using an espresso machine?,<p>I was wondering if it's possible to brew hot chocolate using ground cocoa beans on the espresso m,1,380,04741,,<p>Of course! </p><p>The main variable here are the beans; the process is of less importance. The ma,3,,04742,,"<p>The steam wand will do a terrific job of mixing, heating, and fluffing (what's the technical term",3,,14743,,"<p>The standard refrigerator temperature most official websites assume are around 4C. Yes, there are",1,,04744,,<p>I wouldn’t attempt to dry wet <em>grounds</em> - the quality would likely suffer and for brewing ,1,,24745,,"<p>Zero.</p><p>when you make coffee, (ideally) all of the desireable solubles get extracted, what re",3,,24746,,"<p>Well, when there is no grinder, plunger, filter machine, or espresso machine, and <strong>even no",4,,24747,,"<p>For your situation, you can use the equipment that I travel with:</p><ul><li>an <a href=https://a",3,,04748,Nitrogen wash beans VS Fresh,<p>I live in a really small area. The closet roaster to me is roughly an hour drive away. </p><p>I k,2,205,14749,,"<p>It depends exactly how much pressure can actually be applied.</p><p>To make proper espresso, you ",1,,04750,,<p>I was actually reading an <a href=https://compoundcoffee.com/experiments/13_Pre-infusion-and-its-,1,,04751,,<p>Technically you can use whatever you want to descale a machine. </p><p>Keep in mind the manufactu,2,,24752,,<p>Do not tamp the ground. The extra pressure this will cause could be dangerous.</p><p>Ensure you a,0,,04754,,"<p>I mix instant expresso granules, with milk and sugar, and refrigerate. It usually only last a day",0,,04755,What kind of coffee machine can process powdered coffee?,"<p>I have a drink I like to make using powdered coffee, a coffee grind finer than espresso. but when",1,110,14757,,"<p>Instead of storing in the fridge, follow the standard Italian recommendation (found on lots of It",0,,04758,,"<p>As far as I understood, such coffee is ground for Turkish. If this is the case, you may try to pr",1,,24759,,<p>I too have been roasting a few years with the Fresh Roast SR 500.  I typically roast Kona or Ka'u,0,,04760,Coffee Expired before its mentioned date?,<p>I buy this coffee jar 3 months ago and now coffee is turned into solid round balls is this expire,2,1243,34765,How is green coffee different from usual black coffee?,<p>I recently saw green coffee on the shelves. I do not know how to prepare it - should I treat it l,0,79,04766,,<p>This is a somewhat subjective matter. It is known that you dissolve around 15% of the ingredients,0,,04767,,"<p>If you do not care about filtering the water, you may cut round pieces from any paper filter and ",1,,04768,,"<p>The green coffee beans are, if not spared for home-roasting, are very lightly roast coffee beans.",1,,04769,,"<p>I am afraid that there are two misconceptions</p><p>One, what you have in the jar are not coffee ",3,,04770,What variables influence yield for a stovetop/moka pot?,"<p>I got a moka pot a couple of months ago and have more or less settled on a formula I like, but on",2,570,24773,Can the Breville / Sage Oracle grind and brew simultaneously?,"<p>The Breville / Sage Oracle has a grinder, steam wand and espresso maker (not sure if there is a m",0,159,04774,Coffee machine for a small business,"<p>We have gone through a couple different coffee machines, here at work, none of which are sufficie",3,297,24775,,"<p>I don't have experience with subscription programs, but I have looked at such programs. I think t",2,,04777,,"<h3>Recommendation</h3><p>Since you want a bean-to-cup brew machine, you're limiting yourself quite ",4,,44778,,"<p>It is capable of doing this, but the machine only comes with one porta filter. </p><p>In fact, my",1,,04779,,<p>Yield and the quality of the brew depends on how water is pushed through the grounds. Some things,1,,04780,,,0,,04781,,Questions that are specific to specific models of coffee-related machines.,0,,04782,How do you descale a Breville grind brew machine?,"<p>I am getting a message on my coffee maker that it should be descaled. However, I can not figure o",3,688,04783,,<p>ISO standard 3103: 'Method for preparation of a liquor of tea for use in sensory tests.'</p><p>se,1,,04784,,"<p>If the espresso is pouring too fast it most likely means you need to grind finer, not tamp harder",2,,04785,,"<p>Freshly roasted beans produce more crema, regardless of the variety.</p><p>Many coffee vendors ad",0,,04786,"Does an inconsistent roast affect espresso extraction? If so, how?","<p>I'm not really asking about flavour, I understand that an inconsistent roast causes  inconsistent",1,120,04787,,,0,,04788,,Questions related to the quality and properties of roasted coffee. For questions about the actual ro,0,,04789,,<p>The correct term is <a href=https://www.verywellfit.com/nitrogen-flushing-protects-and-preserves-,1,,14790,,<p>From <a href=https://www.hunker.com/12546087/homemade-coffee-descaling-cleaner rel=nofollow noref,1,,04791,,"<p>Citric acid isn't very effective, it's even weaker than vinegar. Sage (Breville's trade mark in t",3,,04792,,<p>From Time Magazine's <a href=http://time.com/3969509/caffeine-inhalers/ rel=noreferrer>You Can No,6,,04793,,<p>Based on the following comment:</p><blockquote>  <p>No Im asking whenever I serve Lattes or capps,1,,04794,,"<p>MTSan mentions the grind briefly, but I think it's very likely the cause of your problems:</p><bl",3,,04795,I made a mistake ordering ground coffee - will Expresso ground coffee work for a French Press?,<p>Can someone tell me the difference between Expresso ground coffee and French Press ground coffee?,4,344,24796,,<p>Espresso grounds are much finer than those used in French press. French press typically has large,2,,34797,,<h3>Ideally from a business setting</h3><p>Order new coffee and give the grounds away to someone who,5,,24798,,<p>The easiest would be to service the machine. Think of it as bringing your car to the shop or goin,1,,04799,How long is brewed coffee fresh for and what does that blinking light mean at Starbucks?,<p>I asked a Starbucks barista what the blinking light is for on the brewed coffee and he said is st,3,779,04800,How to choose a good grinder for a gaggia espresso machine?,<p>I am using a Gaggia classic espresso machine and am looking for a grinder that will work well in ,1,118,04801,,"<p>For espresso, you should use a <em>stepless</em> grinder (meaning, instead of a small number of g",1,,04802,,<p>Say what you will coffee purists but in search of this exact question I have found topping the gr,0,,24803,,<p>The blinking light means it has been sitting there for 30 mins.</p><p>Starbucks Baristas do in fa,4,,14804,,"<p>Caffeine, a popular CNS stimulant, is the most widely used neuroactive drug. Present in coffee, t",2,,14805,,<p>The blinking light is set on a timer for 30 minutes.  Unlike many coffee shops and pots there is ,1,,14806,My pot no longer percolates water to the top,<p>My pot has worked fine for six months but has stopped working altogether. No water percolates up ,-1,70,24807,,"<p>I make coffee with a moka every morning, and this is the procedure that works for me:</p><ol><li>",1,,04809,why does coffee make some people sleepy?,"<p>I have tried different types of coffee, all causing sleepiness. Except the opposite affect with i",8,230,04810,,"<p>Disclaimer: I'm not a physician, so here are only guesses based on my experience.</p><p>Besides c",4,,14813,How can I repair a leaking drip coffee brewer?,<p>My drip coffee brewer's container has been cracked and it is leaking. I know super glue is toxic.,-1,69,14814,Coffee processing methode and filter brewing guide,<p>I just recently stuck into paper filter brewing and was frustated about the brewing process of a ,0,49,34815,,<p>Fresh grounded coffee is the best.I dont think arabica is good to keep as a ground for more than ,1,,04816,,"<p>Just get a replacement. Given reality, unless it's some super special-to-you drip brewer, get a w",1,,04817,,"<p>The business model for a coffee shop is all about atmosphere, ambience, service. A few pennies wo",0,,14818,How to clean Delonghi Caffe Corso's pre-ground coffee funnel?,<p>I inadvertently put whole beans where ground coffee goes. Will this harm machine’s operation?  Ho,2,4018,04819,,<p>Such automatic machines have a mechanism inside that tamps the pre-ground coffee (put through the,1,,04820,,<p>I wouldn't recommend you using a paper towel for a filter. It will spoil the coffee and might as ,-1,,14825,Ears feel hot and eyes twitch after a cup of coffee,"<p>I have noticed that recently, my ears feel hot just immediately after a cup of coffee. And my eye",0,1386,24830,How to train coffee notes tasting for newbie,<p>So I got few of my friends to join the brotherhood of coffee. And they asked me about the flavor ,2,154,04831,,<p>Did you use sink water to make coffee?If the answer is yes it could be stuck because of the <stro,0,,04832,,"<p>Uh the top post is awesome.By the way, if you have define how is your ideal coffee taste is like ",1,,04833,,<p>I have managed to brew an interesting milk coffee in the <em>ibrik</em>. In order to minimise dep,0,,04834,Should any coffee be extracted during pre-infusion?,"<p>I have a Breville Express, 870XL I think, (single broiler, built in grinder). Lately during pre-i",3,7135,44835,,"<p>I agree with @JJJ's comment. This seems like a tamping problem.</p><p>Still, I advise you to chec",2,,64836,,"<p>As I said in a comment, I'll lay out a few factors that you need to experiment with. </p><blockqu",3,,04839,Petroncini roaster issue,"<p>I have a petroncini raoster, semi-automaticIt's really good, but I whenever I fase an issue, I fi",2,63,14840,,"<p>Sensory skills are one of the most important skills any barista and coffee lover could have. But,",2,,04841,,"<p>The 6oz water measure is before brewing, not afterward. The brew process results in about 5oz in ",1,,14842,coffee with cardamom,<p>I recently tried coffee with some cardamom spice which tasted really great. I'm still wondering i,3,257,14843,What does over-extracted taste like?,<p>The recipe says to stir less if the coffee tastes over-extracted and to stir more if it tastes un,3,179,04844,,"<p>Yes, over- and underextracted are quite different from weak or strong coffee. The strength is det",4,,04845,,<p>WebMD does list some negative side-effects when <a href=https://www.webmd.com/vitamins/ai/ingredi,3,,04846,Coffee tasting notes: myth or reality?,<p>This is what it says on my current beans:</p><blockquote>  <p>lots of raisin and candied fruit pe,4,531,14847,,"<p>What's the Buzz Coffee Co, out of College Station Tx sells cascara retail and wholesale.</p>",0,,04848,,"<p>If I can smell coffee coming from the pack I don't buy it, the packs on the shelf in the shop oft",-3,,14849,What is the industrial method for extracting caffeine to make decaf?,"<p>Is this a solvent extraction method? If so what solvent is used and if it is organic, do the manu",0,130,04850,,<p>I have only read through some of the answers. I am no coffee expert. I too was searching for non-,3,,04851,,"<p>Caffeine is mostly extracted by utilizing very safe processes. Some of them, such as Swiss water,",1,,24853,Does breaching a stovetop milk steamer's double wall destroy it?,<p>I have a stovetop milk steamer &amp; espresso maker whose handle fell off. The spot weld failed a,3,966,34854,,"<p>My guess would be that was filled with air. As far as I can see, the double wall is there just to",1,,04855,Using Nescafe Gold on Espresso Maker,"<p>I'm very new to the land of brewing your own coffee, I just thought of making my own coffee, unti",2,2119,24856,,"<p>Absolutely not!</p><p>The Nescafé is not coffee in the sense of coffee beans, ground, ready for b",5,,04857,,"<p>Ground coffee density is 365 kg/m³, so it's 2,72 times less dense than water, therefore 5 ml of g",3,,14859,nespresso capsule - type with least tannin,<p>I am sensitive to tannin but a big fan of coffee so I'm trying to find a variety that will produc,1,116,04860,Is a Keurig K-Cafe shot really an espresso shot?,"<p>I've been trying a Keurig K-Cafe, which includes a Shot feature that slowly produces what looks l",0,2461,04861,,"<p>Cardamon is a great addition to coffee. It is maybe more suitable for winter, since it makes you ",1,,04862,,"<p>You can use a cesve, like they do in this place: <a href=http://cezvecoffee.ru/ rel=nofollow nore",1,,14863,Conversion of Krups Nespresso Machine to Ground Coffee?,<p>I have inherited a Krups Nespresso machine model F893. The machine has a detachable filter basket,1,127,04864,,<p>The double wall on this steamer is <em>not</em> there for insulation. That idea doesn't add up. A,3,,04865,,"<p>I've tasted some major flavor themes in coffee before. Chocolate, brown sugar, nuts, even fruity ",1,,04866,,"<p>R Mac seems to focus a lot on the brewing, which is certainly important. Another factor, which is",2,,04868,,<p>The bottom of your pot looks like copper and the crusty gunk looks like scaling (minerals left be,1,,04869,Where are high-quality coffee beans harvested?,<p>Which country produces high-quality coffee beans?  Are the tropical countries producers of high-q,3,145,14870,After how many days we should pluck coffee beans from its tree?,<p>After how many days we should pluck coffee beans from its tree for coffee production?</p>,3,44,04871,,"<p>No, it is filter coffee. Espresso is made with high pressure but filter coffee is made by just fi",-1,,04872,,"<p>Many places with various climates do or could produce high quality beans. Guatemala, Peru, Ecuado",3,,04873,,<p>I would recommend <a href=https://rads.stackoverflow.com/amzn/click/com/B01N259LCH rel=nofollow n,1,,04874,,<p>You could get a reusable nespresso capsule <a href=https://www.amazon.de/Wiederbef%C3%BCllbare-Ne,1,,04875,White/greyish mold in a cup,<p>I had a cup of hot chocolate maybe a few months ago and completely forgot about it and its grown ,1,545,04876,,<p>Assuming that the cup is made from ceramic or glass there will not be any problem in cleaning and,2,,14877,,"<p>No, sadly it's absolutely not an espresso shot. </p><p>To get a real espresso shot the ideal sett",2,,44879,,"<p>If you leave your instant coffee in its airtight container open or not fully tightened,it will be",0,,34880,Does café Cubano have a distinct taste of cane sugar alongside the flavor of coffee?,"<p>According to Wikipedia,</p><blockquote>  <p>Café Cubano (also known as Cuban espresso, Cuban coff",1,217,04883,,<p>The Starbucks challenge!  </p><p>Why I came to doing this. I have lost hand strength and require ,2,,04884,,<p>I found the solution by sawing off part of the outer wand. Only the top ring needs to be put back,0,,24885,,"<p>I can’t give you an answer based on tasting the authentic product, but:</p><p>The various “brown”",2,,14888,,<p>I have read that actually decafs have caffeine but way less than regulars. So there could be no r,1,,14889,What temperature to froth/steam OAT milk to? {Rancilio Silvia},<p>I have a v3 Rancilio Silvia with PID and just cant find anything solid online. Thanks. Currently ,1,4344,04892,,<p>I believe the PID setting at 280 F is set to control the boiler temperature. For steaming there m,1,,24893,,"<p>Clean it with soapy water and rinse with very hot water. </p><p>Possibly in addition to, fill wit",0,,04894,,<p>The climate regions close to the equator have the potential to have excellent coffee. This is esp,1,,04895,,<p><a href=https://wikigolden.com/coffee-facts/which-coffees-are-there-12-different-coffee-types-exp,1,,0